,0,1,pdf_names,year,language,authors,title
568,-30.726234,-14.016695,pdf_568.txt,2011,fr,"Moussa Benaissa, Yahia Lebbah",Optimisation de l'extraction de l'alignement des ontologies avec la contrainte de différence
569,22.997503,-23.98592,pdf_569.txt,2011,fr,"Marc Boullé, Romain Guigourès",Optimisation directe des poids de modèles dans un prédicteur Bayésien naïf moyenné
570,-17.285307,36.06399,pdf_570.txt,2011,fr,José L Balcazar ,Parameter-free association rule mining with yacaree
571,-27.427372,40.63264,pdf_571.txt,2011,fr,"Juan David Cruz, Cécile Bothorel, François Poulet",Point of View Based Clustering of Socio-Semantic Networks
572,20.490122,-20.694456,pdf_572.txt,2011,fr,"Nicoleta Rogovschi, Mustapha Lebbah, Nistor Grozavu",Pondération et classification simultanée de données binaires et continues
573,-7.914866,1.9011428,pdf_573.txt,2011,fr,"Mohamed Nadif, François Role",PPMI : étude formelle d'une variante à valeurs positives de la PMI
574,-0.8909316,5.765196,pdf_574.txt,2011,fr,"Sterenn Liberge, Sileye O. Ba, Philippe Lenca, Ronan Fablet",Prévision de trajectoires de cyclones à l'aide de forêts aléatoires avec arbres de régression
575,0.91872185,18.74773,pdf_575.txt,2011,fr,"Thomas Bärecke, Marie-Jeanne Lesot, Herman Akdag, Bernadette Bouchon-Meunier",Prise en compte du réseau de sources pour la fusion d'informations
576,21.960642,-6.462129,pdf_576.txt,2011,fr,"Agnès Braud, Nicolas Lachiche","Propositionaliser des attributs numériques sans les discrétiser, ni les agréger"
577,-23.880022,33.964874,pdf_577.txt,2011,fr,João Gama,Reasoning about the learning process
578,8.321622,-0.9052978,pdf_578.txt,2011,fr,"Yassine Benabbas, Adel Lablack, Thierry Urruty, Chabane Djeraba",Reconnaissance d'Actions par Modélisation du Mouvement
579,-2.4737213,-4.6327586,pdf_579.txt,2011,fr,"Julien Aligon, Elsa Negre, Patrick Marcel",Résumés et interrogations de logs de requêtes OLAP
580,24.709557,-26.384298,pdf_580.txt,2011,fr,"Dhafer Lahbib, Marc Boullé, Dominique Laurent",Sélection des variables informatives pour l'apprentissage supervisé multi-tables
581,-10.674012,7.4556556,pdf_581.txt,2011,fr,"François Paulus, Jérôme Royan",Service de recherche Web3.0 de contenus audiovisuels
582,1.4765141,1.5391514,pdf_582.txt,2011,fr,"Rakia Jaziri, Mustapha Lebbah, Younès Bennani, Jean-Hugues Chenot",Structuration automatique des flux télévisuels par apprentissage non supervisé des répétitions
583,-5.872919,5.9616585,pdf_583.txt,2011,fr,Najeh Hajlaoui,Système de recherche de musique adaptable à la perception de chaque utilisateur
584,-9.172397,-20.747925,pdf_584.txt,2011,fr,Julie Séguéla,Système pour la catégorisation automatique des offres d'emploi en une typologie de fonctions
585,-23.7306,29.518217,pdf_585.txt,2011,fr,Ricardo Baeza-Yates,Towards a DistributedWeb Search Engine
586,-1.7235568,31.692127,pdf_586.txt,2011,fr,"Sébastien Nedjar, Fabien Pesci, Lotfi Lakhal, Rosine Cicchetti",Treillis des concepts SKYLINES : Analyse multidimensionnelle des SKYLINES fondée sur les ensembles en accord
587,27.92255,1.3266671,pdf_587.txt,2011,fr,"Marc Boullé, Dominique Gay",Un critère Bayésien pour évaluer la robustesse des règles de classification
588,-7.9751196,-13.458258,pdf_588.txt,2011,fr,"Freddy Limpens, Fabien Gandon, Michel Buffa",Un cycle de vie complet pour l'enrichissement sémantique des folksonomies
589,-6.630838,3.2263792,pdf_589.txt,2011,fr,"Emilie Guimier De Neef, Aurélien Bossard, Frédéric Gavignet, Olivier Collin",Un outil de géolocalisation et de résumé automatique pour faciliter l'accès à l'information dans des corpus d'actualité
590,-13.060763,-20.852064,pdf_590.txt,2011,fr,"Yann Vigile Hoareau, Murat Ahat, David Medernach, Marc Bui",Un outil de navigation dans un espace sémantique
591,0.05279065,8.1323395,pdf_591.txt,2011,fr,"Baghdad Atmani, Mohamed Benamina, Bouziane Beldjilali",Un système cellulaire neuro-symbolique pour l'extraction et la gestion des connaissances
592,17.426702,4.7417727,pdf_592.txt,2011,fr,"Olivier Pivert, Amine Mokhtari, Allel HadjAli",Une Approche à Base de Règles Floues pour les Requêtes à Préférences Contextuelles
593,-28.14041,-12.553534,pdf_593.txt,2011,fr,"Ammar Mechouche, Nathalie Abadie, Sébastien Mustière",Une mesure de distance dans l'espace des alignements entre parties potentiellement homologues de deux ontologies légères
594,10.083826,22.182245,pdf_594.txt,2011,fr,"Julien Blanchard, Thomas Piton, Henri Briand, Fabrice Guillet",Une méthodologie de recommandations produits fondée sur l'actionnabilité et l'intérêt économique des clients
595,-6.7049375,-9.430394,pdf_595.txt,2011,fr,"Benjamin Duthil, François Trousset, Mathieu Roche, Michel Plantié, Gérard Dray, Jacky Montmain",Une nouvelle approche pour l'extraction non supervisée de critères
596,22.265621,-15.069693,pdf_596.txt,2011,fr,"Mustapha Lebbah, Hanane Azzag",Une nouvelle approche visuelle pour la classification hiérarchique et topologique
597,-25.060827,-12.518155,pdf_597.txt,2011,fr,"Ammar Mechouche, Nathalie Abadie, Emeric Prouteau, Sébastien Mustière",Utilisation d'une ontologie du domaine pour la découverte du contenu de bases de données géographiques
598,-0.18856359,8.14744,pdf_598.txt,2011,fr,"Fatiha Barigou, Baghdad Atmani, Bouziane Beldjilali",Utilisation de la Machine Cellulaire pour la Détection des Courriels Indésirables
599,-28.919416,-13.430321,pdf_599.txt,2011,fr,"Fayçal Hamdi, Brigitte Safar, Chantal Reynaud",Utiliser des résultats d'alignement pour enrichir une ontologie
600,-10.113522,13.239613,pdf_600.txt,2011,fr,"Laurent Lecornu, Clara Le Guillou, Frédéric Le Saux, Matthieu Hubert, Julien Montagner, John Puentes, Jean-Michel Cauvin",Vers la fusion d'informations hétérogènes et partielles pour l'aide au codage diagnostique
601,16.427422,-21.316984,pdf_601.txt,2011,fr,"Guénaël Cabanes, Younès Bennani",Visualisation de l'intra et inter structure des groupes en classification non supervisée
602,-14.316932,20.223276,pdf_602.txt,2010,fr,"Minh Thu Tran Nguyen, François Sempé, Jean-Daniel Zucker",AbsTop-K &#945;: un algorithme d'extraction de paires abstraites hautement corrélées pour mieux recommander dans la ”longue traine
603,-16.22644,34.47016,pdf_603.txt,2010,fr,Zbigniew W. Ras,Action Rules and Meta-actions
604,9.016602,-10.533347,pdf_604.txt,2010,fr,"Victor Gabillon, Jérémie Mary, Philippe Preux",Affichage de publicités sur des portails web
605,-17.349546,10.395804,pdf_605.txt,2010,fr,Florent Domenach,"Agrégation de systèmes de fermetures: cas des hiérarchies, topologies et géométries convexes"
606,38.857697,-1.2245079,pdf_606.txt,2010,fr,"Julien Rabatel, Sandra Bringay, Pascal Poncelet",Aide à la décision pour la maintenance ferroviaire préventive
607,46.088875,4.9337564,pdf_607.txt,2010,fr,"Mehdi Khiari, Patrice Boizumault, Bruno Crémilleux",Allier CSPs et motifs locaux pour la découverte de motifs sous contraintes n-aires
608,-16.629927,-12.6270075,pdf_608.txt,2010,fr,"Boutheina Smine, Rim Faiz, Jean-Pierre Desclés",Analyse de documents pédagogiques en vue de leur annotation
609,40.105953,-4.4598126,pdf_609.txt,2010,fr,"Nicolas S. Müller, Matthias Studer, Alexis Gabadinho, Gilbert Ritschard",Analyse de séquences d'événements avec TraMineR
610,2.069296,-16.946287,pdf_610.txt,2010,fr,"Loïc Mabit, Sabine Loudcher, Omar Boussaid",Analyse en ligne d'objets complexes avec l'analyse factorielle
611,7.8011656,-0.15091228,pdf_611.txt,2010,fr,"Yassine Benabbas, Nacim Ihaddadene, Thierry Urruty, Chabane Djeraba",Analyse globale du flux optique pour la détection d'évènements dans une scène de foule
612,-6.6817245,-1.5431494,pdf_612.txt,2010,fr,"Taoufik Yeferny, Khedija Arour",Analyse incrémentale des usages pour le routage des requêtes dans les systèmes pairs à pairs
613,-27.137156,36.213654,pdf_613.txt,2010,fr,"Jean Baptiste Faddoul, Boris Chidlovskii",Applying Markov Logic to Document Annotation and Citation Deduplication
614,5.250764,15.428437,pdf_614.txt,2010,fr,"Hana Alouaoui, Sami Yassine Turki, Sami Faiz",Apport de la technique de fouille de données spatiales dans la prédiction des risques engendrés par les changements climatiques
615,-9.809153,2.822193,pdf_615.txt,2010,fr,"Valentina Dragos, Marie-Christine Jaulent",Apprentissage de patrons lexico-syntaxiques à partir de textes
616,-0.49945942,-0.9752096,pdf_616.txt,2010,fr,"Matthieu Lopez, Lionel Martin",Apprentissage de spécifications de CSP
617,-0.41301054,-25.212189,pdf_617.txt,2010,fr,"Mondher Maddouri, Nida Meddouri",Apprentissage supervisé adaptatif de Concepts Formels à partir des données nominales
618,6.551108,9.927451,pdf_618.txt,2010,fr,"Lydia Boudjeloud, Hanane Azzag",Approche biomimétique coopérative pour la visualisation de grands graphes multidimensionels
619,4.924919,-36.394417,pdf_619.txt,2010,fr,"Mickaël Coustaty, Giap NGuyen, Vincent Courboulay, Jean-Marc Ogier",Approche complexe de l'analyse de documents anciens
620,-2.8562133,15.437198,pdf_620.txt,2010,fr,"Hakim Hacid, Johann Stan, Johann Daigremont",Approche Sémantique pour la Préservation de la Vie Privée dans les Médias Sociaux
621,-12.096075,-21.690731,pdf_621.txt,2010,fr,"Sandra Bringay, Anne Laurent, Pascal Poncelet, Mathieu Roche, Maguelonne Teisseire","Bien cube, les données textuelles peuvent s'agréger !"
622,-23.417309,-14.076427,pdf_622.txt,2010,fr,"Radja Messai, Michel Simonet, Nathalie Bricon-Souf, Mireille Mousseau",Caractériser la terminologie des usagers de santé dans le domaine du cancer du sein
623,-17.458162,12.613626,pdf_623.txt,2010,fr,"Menaouer Brahami, Baghdad Atmani, Mostéfa Mokaddem",CARTOCEL : Un outil de cartographie des connaissances guidée par la machine cellulaire CASI
624,-11.7056055,20.342722,pdf_624.txt,2010,fr,"Ibtissem Cherni, Karla Lopez, Robert Laurini, Sami Faiz",ChorML : Résumés visuels de bases des données géographiques
625,40.13434,-5.879557,pdf_625.txt,2010,fr,"Matthias Studer, Nicolas S. Müller, Gilbert Ritschard, Alexis Gabadinho","Classer, discriminer et visualiser des séquences d'événements"
626,-12.969693,-25.721268,pdf_626.txt,2010,fr,"Karim Djemal, Chantal Soulé-Dupuy, Nathalie Vallès-Parlangeau",Classification de documents : calcul d'une distance structurelle
627,-24.810991,15.494464,pdf_627.txt,2010,fr,"Thierry Urruty, Ismail Elsayad, Adel Lablack, Yue Feng, Jose M. Joemon",Classification et Selection de caracteristique basees sur les concepts semantiques pour la recherche d'information multimedia
628,22.574139,-26.162813,pdf_628.txt,2010,fr,Marc Boullé,Classification supervisée pour de grands nombres de classes à prédire : une approche par co-partitionnement des variables explicatives et à expliquer
629,39.440296,3.1557512,pdf_629.txt,2010,fr,"Hanen Brahmi, Tarek Hamrouni, Riadh Ben Messaoud, Sadok Ben Yahia",CND-Cube : Nouvelle représentation concise sans perte d'information d'un cube de données
630,-4.5699043,1.1549205,pdf_630.txt,2010,fr,"Mohamed Hallab, Bruno Delprat, Alain Lelu",Codage et classification non supervisée d'un corpus maya : extraire des contextes pour situer l'inconnu par rapport au connu
631,-27.0873,-3.5788703,pdf_631.txt,2010,fr,Marie-Christine Rousset,Combiner approche logique et numérique pour la réconciliation de données et l'alignement d'ontologies
632,-20.527096,-12.859934,pdf_632.txt,2010,fr,"Alexandre Passant, Philippe Laublet",CombinerWeb 2.0 et Web Sémantique pour réduire les disparités d'expertise au sein de blogs d'entreprise
633,10.040037,-19.555056,pdf_633.txt,2010,fr,"Germain Forestier, Cédric Wemmert, Pierre Gançarski",Comparaison de critères de pureté pour l'intégration de connaissances en clustering semi-supervisé
634,16.415005,-21.386871,pdf_634.txt,2010,fr,"Guénaël Cabanes, Younès Bennani",Comparaisons structurelles de grandes bases de données par apprentissage non-supervisé
635,-4.7021565,15.142197,pdf_635.txt,2010,fr,"Abderrahmane Maaradji, Hakim Hacid, Johann Daigremont, Noël Crespi",Composition de ServicesWeb Basée sur les Réseau Sociaux
636,21.98273,-11.877532,pdf_636.txt,2010,fr,"Vincent Pisetta, Pierre-Emmanuel Jouve, Djamel Abdelkader Zighed",Construction de noyaux pour l'apprentissage supervisé à partir d'arbres aléatoires
637,-18.857971,9.996555,pdf_637.txt,2010,fr,"Sébastien Nedjar, Alain Casali, Rosine Cicchetti, Lotfi Lakhal",Cubes Fermés / Quotients Émergents
638,-27.09244,-11.286404,pdf_638.txt,2010,fr,"Jean Charlet, Sylvie Szulman, Nathalie Aussenac-Gilles, Adeline Nazarenko, Nathalie Hernandez, Nadia Nadah, Éric Sardet, Jean Delahousse, Valery Teguiak, Audrey Baneyx",DaFOE: une plateforme pour construire des ontologies à partir de textes et de thésaurus
639,32.341263,9.48205,pdf_639.txt,2010,fr,"Benjamin Négrevergne, Alexandre Termier, Jean-François Méhaut, Takeaki Uno",Découverte d'itemsets fréquents fermés sur architectures multicoeurs
640,18.343737,-0.50366884,pdf_640.txt,2010,fr,"Thierno Diallo, Noel Novelli",Découverte des dépendances fonctionnelles conditionnelles fréquentes
641,-24.362303,34.98571,pdf_641.txt,2010,fr,"Marie-Luce Picard, Benoît Grossin, Alexis Bondu",Density estimation on data streams : an application to Change Detection
642,-24.282179,33.95221,pdf_642.txt,2010,fr,"Vasile-Marian Scuturici, Dan-Mircea Suciu, Romain Vuillemot, Aris Ouksel, Lionel Brunie",Detecting Anomalies in Data Streams using Statecharts
643,3.9478989,5.022113,pdf_643.txt,2010,fr,"Md. Haidar Sharif, Husam Alustwani, Ioan Marius Bilasco, Chabane Djeraba",Détection des mouvements anormaux dans des vidéos
644,-1.4210045,-24.623747,pdf_644.txt,2010,fr,"Besma Khalfi, Rahma Cherif, Nida Meddouri, Mondher Maddouri",Développement de méthodes de classification basées sur l'Analyse de Concepts Formels sous la plateforme WEKA
645,-25.661741,16.18093,pdf_645.txt,2010,fr,"Siwar Zribi Boujelbene, Dorra Ben Ayed Mezghanni, Noureddine Ellouze",Differentes variantes GMM-SMOs pour l'identification du locuteur
646,0.38728446,10.9389105,pdf_646.txt,2010,fr,"Thabet Slimani, Boutheina Ben Yaghlane",Etude comparative des langages de requêtes sémantiques pour l'extraction des liens complexes dans une base de connaissances
647,43.1976,4.120683,pdf_647.txt,2010,fr,"Rabie Saidi, Sabeur Aridhi, Mondher Maddouri, Engelbert Mephu Nguifo",Etude de stabilité de méthodes de sélection de motifs à partir des séquences protéiques
648,-21.901957,-11.0157175,pdf_648.txt,2010,fr,"Ines Fayech, Habib Ounalli",Expansion de requêtes SQL par une ontologie de domaine
649,-26.585064,-3.0862825,pdf_649.txt,2010,fr,"Souhir Gahbiche, Nathalie Pernelle, Fatiha Saïs",Explication de décisions de réconciliation : approche fondée sur les réseaux de Petri colorés
650,18.845114,0.77313155,pdf_650.txt,2010,fr,"Pierre Allard, Sébastien Ferré",Exploration de dépendances fonctionnelles et de règles d'association avec OLAP
651,31.54584,9.078053,pdf_651.txt,2010,fr,"Chongsheng Zhang, Florent Masseglia",Extraction d'itemsets distinctifs dans les flux de données
652,3.482384,5.665115,pdf_652.txt,2010,fr,"Adel Lablack, Thierry Urruty, Yassine Benabbas, Chabane Djeraba",Extraction de la région d'intérêt d'une personne sur un obstacle
653,41.8239,2.5064728,pdf_653.txt,2010,fr,"Sarra Ayouni, Sadok Ben Yahia, Anne Laurent, Pascal Poncelet",Extraction de motifs graduels clos
654,39.13057,-6.459289,pdf_654.txt,2010,fr,"Nicolas S. Müller, Matthias Studer, Gilbert Ritschard, Alexis Gabadinho",Extraction de règles d'association séquentielle à l'aide de modèles semi-paramétriques à risques proportionnels
655,40.359856,-3.1630578,pdf_655.txt,2010,fr,"Cherif Chiraz Latiri, Cyrine Nasri, Kamel Smaïli, Yahya Slimani",Extraction des séquences fermées fréquentes à partir de corpus parallèles : Application à la traduction automatique
656,5.2824497,9.687818,pdf_656.txt,2010,fr,"Zohra Ben Said, Fabrice Guillet, Paul Richard",Fouille visuelle de données en 3D et réalité virtuelle : état de l'art
657,-17.977253,-9.215381,pdf_657.txt,2010,fr,"Michel Buffa, Catherine Faron-Zucker, Anna Kolomoyskaya",Gestion sémantique des droits d'accès au contenu: l'ontologie AMO
658,-28.724394,40.790333,pdf_658.txt,2010,fr,"Faraz Zaidi, Guy Melançon",Identifying the Presence of Communities in Complex Networks Through Topological Decomposition and Component Densities
659,17.74537,-0.96798474,pdf_659.txt,2010,fr,Ghada Gasmi,IncFDs: un nouvel algorithme d'inférence incrémentale des dépendances fonctionnelles
660,4.440869,-37.24582,pdf_660.txt,2010,fr,"Nguyen-Khang Pham, François Poulet, Annie Morin, Patrick Gros",Indexation et recherche d'images à très grande échelle avec une AFC incrémentale et parallèle sur GPU
661,41.374874,-4.649108,pdf_661.txt,2010,fr,"Alexis Gabadinho, Gilbert Ritschard, Matthias Studer, Nicolas S. Müller",Indice de complexité pour le tri et la comparaison de séquences catégorielles
662,13.222888,-12.541412,pdf_662.txt,2010,fr,"Fadi Dornaika, Fadi Chakik",Inférence Bayesienne du Maximum d'Entropie pour le Diagnostic du Cancer
663,13.370144,-12.937424,pdf_663.txt,2010,fr,"Fadi Chakik, Fadi Dornaika",Intégration de Connaissances a Priori dans le Principe du Maximum d'Entropie
664,10.854922,-25.110006,pdf_664.txt,2010,fr,"Guillaume Cleuziou, Frédéric Moal, Lionel Martin, Matthieu Exbrayat",Intégration interactive de contraintes pour la réduction de dimensions et la visualisation
665,-1.3072892,-4.677498,pdf_665.txt,2010,fr,"Nesrine Gabsi, Fabrice Clérot, Georges Hébrail",Interrogation des résumés de flux de données
666,-5.6784315,4.5014906,pdf_666.txt,2010,fr,"Audrey Baneyx, Philippe Breucker",K-WORDS LAB : un outil d'analyse des mots clés permettant d'explorer les dynamiques d'un domaine scientifique.
667,1.4411508,11.077235,pdf_667.txt,2010,fr,"Olivier Corby, Catherine Faron-Zucker",KGRAM: une machine abstraite de graphes de connaissance
668,-0.44874528,20.68581,pdf_668.txt,2010,fr,Arnaud Martin,Le conflit dans la théorie des fonctions de croyance
669,-17.158236,-20.122746,pdf_669.txt,2010,fr,"Lynda Said L'Hadj, Mohand Boughanem",Modèle de Langue à base de Concepts pour la Recherche d'Information
670,-7.0910635,-5.620492,pdf_670.txt,2010,fr,"Boris Verhaegen, Esteban Zimányi, Serge Boucher",Modélisation et interrogation de données XML multidimensionnelles
671,-27.04951,28.745146,pdf_671.txt,2010,fr,"Anthony Ventresque, Thomas Cerqueus, Louis-Alexandre Celton, Gaëtan Hervouet, Damien Levin, Philippe Lamarre, Sylvie Cazalens",Mysins : Make Your Semantic INformation System
672,-17.285555,36.009785,pdf_672.txt,2010,fr,José L Balcazar ,Objective Novelty of Association Rules: Measuring the Confidence Boost1
673,14.45775,-22.373392,pdf_673.txt,2010,fr,Guillaume Cleuziou,OSOM : un algorithme de construction de cartes topologiques recouvrantes
674,-19.582727,31.738062,pdf_674.txt,2010,fr,Mohammed Zaki,"Pattern Mining: The Past, Present, and Future"
675,24.2674,3.042976,pdf_675.txt,2010,fr,"Mohamed Salah Gouider, Eya Ben Ahmed",PCAR : Nouvelle Approche de Génération de Règles d'Association Cycliques
676,41.18925,2.4601262,pdf_676.txt,2010,fr,"Anne Laurent, Benjamin Négrevergne, Nicolas Sicard, Alexandre Termier",PGP-mc : extraction parallèle efficace de motifs graduels
677,8.95567,-0.9771473,pdf_677.txt,2010,fr,"Rémi Auguste, Ahmed El Ghini, Ioan Marius Bilasco, Chabane Djeraba",Prédiction de séries temporelles et applications à l'analyse de séquences vidéo
678,-9.971157,9.825589,pdf_678.txt,2010,fr,"Sofiane Ben Amor, Vincent Levorato",PretopoLib: la librairie JAVA de la Prétopologie
679,15.055665,2.575763,pdf_679.txt,2010,fr,"Doulkifli Boukraâ, Omar Boussaid",Proposition d'opérateurs OLAP pour un modèle multidimensionnel à base d'objets complexes
680,27.750227,-0.62426835,pdf_680.txt,2010,fr,"Emna Bahri, Stéphane Lallich",Proposition d'une méthode de classification associative adaptative
681,-18.552711,15.838612,pdf_681.txt,2010,fr,"Wajdi Dhifli, Rabie Saidi",Protein Graph Repository
682,-23.71672,39.73463,pdf_682.txt,2010,fr,Francisco de Assis Tenório de Carvalho,Recent Advances in Partitioning Clustering Algorithms for Interval-Valued Data
683,-26.421412,-15.766753,pdf_683.txt,2010,fr,"Nesrine Ben Mustapha, Hajer Baazaoui Zghal, Marie-Aude Aufaure, Henda Ben Ghézala",Recherche sémantique sur le Web basée sur l'ontologie Modulaire et le raisonnement à base de cas
684,-15.286216,-19.336266,pdf_684.txt,2010,fr,"Wahiba Ben Abdessalem Karaa, Bilel Bouchamia",Reconnaissance de concepts basée sur l'apprentissage
685,2.7021813,-34.63465,pdf_685.txt,2010,fr,Marc Joliveau,Réduction bi-directionnelle d'images - Vers une méthode d'extraction de caractéristiques multi-niveaux
686,5.5196214,-12.106424,pdf_686.txt,2010,fr,"Florent Masseglia, Alice Marascu, Yves Lechevallier",REGLO : une nouvelle stratégie pour résumer un flux de séries temporelles
687,-12.163323,-27.21405,pdf_687.txt,2010,fr,"Marian-Andrei Rizoiu, Julien Velcin, Jean-Hugues Chauchat",Regrouper les données textuelles et nommer les groupes à l'aide de classes recouvrantes
688,-1.7380939,30.985348,pdf_688.txt,2010,fr,"Tassadit Bouadi, Sandra Bringay, Pascal Poncelet, Maguelonne Teisseire",Requêtes skyline avec prise en compte des préférences utilisateurs pour des données volumineuses
689,-0.6714545,-4.8120055,pdf_689.txt,2010,fr,"Christine Potier, Georges Hébrail",Résumé généraliste de flux de données
690,-24.887827,16.972557,pdf_690.txt,2010,fr,"Fekade Getahun, Richard Chbeir",RSS Merger
691,43.727264,0.14381848,pdf_691.txt,2010,fr,"Yoann Pitarch, Lionel Vinceslas, Anne Laurent, Pascal Poncelet, Jean-Emile Symphor",SALINES : un automate au service de l'extraction de motifs séquentiels multidimensionnels
692,-11.849051,-24.705395,pdf_692.txt,2010,fr,"Christophe Moulin, Christine Largeron",Sélection par entropie de descripteurs textuels pour la catégorisation de documents
693,-24.370707,40.563385,pdf_693.txt,2010,fr,"Guillem Lefait, Gilles Goncalves, M. Tahar Kechadi",Self-Clustering for Identification of Customer Purchase Behaviours
694,41.36125,-2.6348183,pdf_694.txt,2010,fr,"Arnaud Sallaberry, Nicolas Pecheur, Sandra Bringay, Mathieu Roche, Maguelonne Teisseire",SequencesViewer : comment rendre accessible des motifs séquentiels de gènes trop nombreux
695,-17.881145,-13.506095,pdf_695.txt,2010,fr,"Jihen Majdoubi, Mohamed Tmar, Faïez Gargouri",SIAM: Système d'Indexation des Articles Médicaux
696,9.2111635,14.450494,pdf_696.txt,2010,fr,"Ibrahim Chahid, Loic Martin, Sofian Maabout, Mohamed Mosbah",Simplification de données de vol pour un stockage optimal et une visualisation accélérée
697,-25.661776,16.180927,pdf_697.txt,2010,fr,"Nicolas Lumineau, Lionel Médini",SimTole
698,22.145569,-15.260551,pdf_698.txt,2010,fr,"Mustapha Lebbah, Hanane Azzag",SoTree : Auto-organisation topologique et hiérarchique des données
699,17.047266,-19.869009,pdf_699.txt,2010,fr,"Younès Bennani, Mustapha Lebbah",Sous-échantillonnage topographique par apprentissage semi-supervisé
700,-6.9355736,20.69288,pdf_700.txt,2010,fr,"Abdelmalek Toumi, Christophe Osswald, Ali Khenchaf",Suivi d'Automobiles par Classification Hiérarchique Ascendante
701,4.7759857,-9.480763,pdf_701.txt,2010,fr,"Ghada Trabelsi, Mounir Ben Ayed, Adel M. Alimi",Système d'extraction des connaissances à partir des données temporelles basé sur les Réseaux Bayésiens Dynamiques
702,-19.030062,27.84715,pdf_702.txt,2010,fr,"David Auber, Patrick Mary, Morgan Mathiaut, Jonathan Dubois, Antoine Lambert, Dan Archambault, Romain Bourqui, Bruno Pinaud, Maylis Delest, Guy Melançon",Tulip: a Scalable Graph Visualization Framework
703,8.309854,-27.802393,pdf_703.txt,2010,fr,"Teh Amouh, Monique Noirhomme-Fraiture, Benoît Macq",Un modèle d'extraction de masses de croyance à partir de probabilités a posteriori pour une amélioration des performances en classification supervisée
704,-12.824872,-17.29567,pdf_704.txt,2010,fr,"Rim Bentebibel, Adeline Nazarenko, Sylvie Szulman",Un système d'aide à l'extraction de relations sémantiques pour la construction d'ontologies à partir de textes
705,-2.5730712,-4.2571826,pdf_705.txt,2010,fr,"Patrick Bosc, Allel HadjAli, Olivier Pivert, Grégory Smits",Une approche fondée sur la corrélation entre prédicats pour le traitement des réponses pléthoriques
706,-24.473572,16.25434,pdf_706.txt,2010,fr,"Nacim Fateh Chikhi, Bernard Rothenburger, Nathalie Aussenac-Gilles",Une approche probabiliste pour l'identification de structures de communautés
707,-20.364866,-1.1915753,pdf_707.txt,2010,fr,"Mohamed Turki, Inès Saad, Gilles Kassel, Faïez Gargouri",Une méthode d'aide au management de connaissances pour améliorer le processus de suivi et d'évaluation de la prise en charge précoce des enfants IMC : application de l'ASHMS
708,-28.704742,-14.436667,pdf_708.txt,2010,fr,"Fatma Kaâbi, Faïez Gargouri",Une nouvelle approche de découverte des correspondances complexes entre ontologies
709,12.664123,-14.099976,pdf_709.txt,2010,fr,"Alexis Bondu, Vincent Lemaire, Marc Boullé",Une nouvelle stratégie d'Apprentissage Bayésienne
710,-24.24904,-12.232972,pdf_710.txt,2010,fr,"François Rousselot, Cecilia Zanni, Denis Cavallucci",Une Ontologie pour l'Acquisition et l'Exploitation des Connaissances en Conception Inventive
711,31.436565,10.244146,pdf_711.txt,2010,fr,"Yoann Pitarch, Anne Laurent, Pascal Poncelet",Une structure basée sur les hiérarchies pour synthétiser les itemsets fréquents extraits dans des fenêtres temporelles
712,2.9163644,10.059341,pdf_712.txt,2010,fr,"Romain André-Lovichi, Kamel Smaïli, David Langlois",Utilisation de graphes sémantiques pour l'extraction et la traduction des idées essentielles d'un texte
713,7.444949,17.634466,pdf_713.txt,2010,fr,"Frédéric Flouvat, Nazha Selmaoui-Folcher, Dominique Gay",Vers une extraction et une visualisation des co-localisations adaptées aux experts
