,0,1,pdf_names,year,language,authors,title
0,-11.0217495,27.369247,pdf_0.txt,2018,fr,"Claudia Marinica, Julien Longhi, Nader Hassine, Abdulhafiz Alkhouli, Boris Borzic",#Idéo2017 : une plateforme citoyenne dédiée à l'analyse des tweets lors des événements politiques
1,-23.133917,38.939445,pdf_1.txt,2018,fr,"Marius Barctus, Marc Boullé, Fabrice Clérot",A two level co-clustering algorithm for very large data sets
2,11.560429,5.032366,pdf_2.txt,2018,fr,"Jean-Benoît Griesner, Talel Abdesssalem, Hubert Naacke, Pierre Dosne",ALGeoSPF: Un modèle de factorisation basé sur du clustering géographique pour la recommandation de POI
3,11.451714,-8.215626,pdf_3.txt,2018,fr,"Abdeljalil Elouardighi, Mohcine Maghfour, Hafdalla Hammia, Fatima-Zahra Aazi",Analyse des sentiments à partir des commentaires Facebook publiés en Arabe standard ou dialectal marocain par une approche d'apprentissage automatique
4,-10.799533,-18.62074,pdf_4.txt,2018,fr,"Elyase Lassouli, Yasmine Mesbahi, Camille Pradel, Damien Sileo",Analyse en rôles sémantiques pour le résumé automatique
5,-25.632706,-11.014352,pdf_5.txt,2018,fr,"Marwan Batrouni, Aurélie Bertaux, Christophe Nicolle",Analyse Ontologique de scénario dans un contexte Big Data
6,-8.43251,14.332907,pdf_6.txt,2018,fr,"Romain Billot, Sofian Berrouiguet, Mark Larsen, Michel Walter, Jorge López Castroman, Enrique Baca-García, Philippe Courtet, Philippe Lenca",Apport de la fouille de données pour la prévention du risque suicidaire
7,19.532198,-25.229832,pdf_7.txt,2018,fr,"Vincent Lemaire, Oumaima Alaoui Ismaili",Apport des modèles locaux pour les K-moyennes prédictives
8,28.946575,-12.383913,pdf_8.txt,2018,fr,"Khalil Laghmari, Christophe Marsala, Mohammed Ramdani",Apprendre les relations de préférence et de co-occurrence entre les labels en classification multi-labels
9,9.300905,-10.720844,pdf_9.txt,2018,fr,"Emmanuelle Claeys, Pierre Gançarski, Myriam Maumy-Bertrand",Approche contextuelle par régression pour les tests A/B
10,-20.77319,36.993847,pdf_10.txt,2018,fr,Fosca Giannotti,Big Data for understanding human dynamics: the power of networks
11,10.632416,-17.79833,pdf_11.txt,2018,fr,"Denis Maurel, Jérémie Sublime, Sylvain Lefebvre",Cartes Auto-Organisatrices Incrémentales appliquées au Clustering Collaboratif
12,-9.924982,0.40457547,pdf_12.txt,2018,fr,"Bastien Latard, Jonathan Weber, Germain Forestier, Michel Hassenforder",Catégorisation d'articles scientifiques basée sur les relations sémantiques des mots-clés
13,16.642292,-23.309052,pdf_13.txt,2018,fr,"Étienne-Cuvelier, Marie-Aude-Aufaure",Classification de Données Complexes par Globalisation de Mesures de Similarité via les Moyennes Quasi-Arithmétiques
14,-25.850882,31.51381,pdf_14.txt,2018,fr,Santo Fortunato,Community structure in complex networks
15,9.449447,10.2384815,pdf_15.txt,2018,fr,"Marwan Ghanem, Clémence Magnien, Fabien Tarissan",Comparaison de mesures de centralité basées sur les plus courts chemins dans les réseaux dynamiques
16,-10.245515,-18.252232,pdf_16.txt,2018,fr,"Julien Hay, Tim Van de Cruys, Philippe Muller, Bich-Liên Doan, Fabrice Popineau, Lyes Benamsili",Complémentarités de représentations vectorielles pour la similarité sémantique
17,-2.7352018,-13.409223,pdf_17.txt,2018,fr,"Badre Belabbess, Jérémy Lhez, Musab Bairat, Olivier Curé",Contextualisation de Singularités en Temps-Réel par Extraction de Connaissances du Web des Données
18,-19.945904,-8.428095,pdf_18.txt,2018,fr,"Philippe Martin, Jun Jo",Contraintes prescriptives compatibles avec OWL2-ER pour évaluer la complétude d'ontologies
19,-3.3073075,-23.244339,pdf_19.txt,2018,fr,"Alain Gély, Miguel Couceiro, Yassine Namir, Amedeo Napoli",Contribution à l'étude de la distributivité d'un treillis de concepts
20,42.72763,1.5037417,pdf_20.txt,2018,fr,"Simon Ser, Fatiha Saïs, Maguelonne Teisseire",Découverte de motifs graduels partiellement ordonnés : application aux données d'expériences scientifiques
21,26.156414,3.0338697,pdf_21.txt,2018,fr,"Justine Reynaud, Esther Galbrun, Mehwish Alam, Yannick Toussaint, Amedeo Napoli",Définir les catégories de DBpédia avec des règles d'associations et des redescriptions
22,-2.5936894,-13.271772,pdf_22.txt,2018,fr,"Badre Belabbess, Musab Bairat, Jérémy Lhez, Olivier Curé",Détection de Singularités en temps-réel par combinaison d'apprentissage automatique et web sémantique basés sur Spark
23,44.095573,-1.122364,pdf_23.txt,2018,fr,"Lamine Diop, Cheikh Talibouya Diop, Arnaud Giacometti, Dominique Li, Arnaud Soulet",Echantillonnage de motifs séquentiels sous contrainte sur la norme
24,18.037346,14.816485,pdf_24.txt,2018,fr,"Antoine Laumond, Norbert Feron, Guy Melançon, Bruno Pinaud",eDOI : exploration itérative de grands graphes multi-couches basée sur une mesure de l'intérêt de l'utilisateur
25,-19.231926,-5.5490026,pdf_25.txt,2018,fr,"Nicolas Faure, René-Michel Faure",Elaboration et utilisation d'une base de connaissances d'un domaine technique.
26,2.4976592,8.939952,pdf_26.txt,2018,fr,"Nacéra Bennacer Seghouani, Francesca Bugiotti, Jorge Galicia, Mariana Patricio, Gianluca Quercini",Élimination des liens inter-langues erronés dans Wikipédia
27,12.618219,7.6325784,pdf_27.txt,2018,fr,"Rémy Kessler, Guy Lapalme, Fabrizio Gotti, Abdessamad Outerqiss, Philippe Langlais",Et si les réseaux sociaux pouvaient nous aider dans nos choix de carrière?
28,-11.94462,-19.863058,pdf_28.txt,2018,fr,"Lucie Martinet, Hussein T. Al-Natsheh, Fabien Rico, Fabrice Muhlenbach, Djamel A. Zighed",Étiquetage thématique automatisé de corpus par représentation sémantique
29,10.788749,10.199834,pdf_29.txt,2018,fr,"Kévin Deturck, Damien Nouvel, Frédérique Segond",Évaluation comparative d'algorithmes de centralité pour la détection d'influenceurs
30,8.043238,-9.023516,pdf_30.txt,2018,fr,"Yelen Per, Kevin Dalleau, Malika Smail-Tabbone",Exploration et analyses multi-objectifs de séries temporelles de données météorologiques
31,-10.455084,-6.247387,pdf_31.txt,2018,fr,"Charles Huyghues-Despointes, Leila Khouas, Julien Velcin, Sabine Loudcher",Extraction de chaînes cohérentes en vue de reconstuire la Trajectoire de l'information
32,-2.321919,7.894477,pdf_32.txt,2018,fr,"Iwo Doboszewski, Simon Fossier, Christophe Marsala",Extraction de connaissances sur les défaillances de compteurs d'essieux
33,41.675556,3.2979858,pdf_33.txt,2018,fr,"Jerry Lonlac, Benjamin Négrevergne, Yannick Miras, Aude Beauger, Engelbert Mephu Nguifo",Fouille de Motifs Graduels Fermés Fréquents Sous Contrainte de la Temporalité
34,45.225487,1.8722833,pdf_34.txt,2018,fr,"Katerina Tsesmeli, Manel Boumghar, Thomas Guyet, Rene Quiniou, Laurent Pierre",Fouille de motifs temporels négatifs
35,-8.700169,-6.7588696,pdf_35.txt,2018,fr,"Hamdi Ben Hamadou,  Faiza Ghozzi, André Péninou, Olivier Teste",Interrogation de données structurellement hétérogènes dans les bases de données orientées documents
36,-14.728699,19.97867,pdf_36.txt,2018,fr,"Sarra Bouzayane, Inès Saad",KTI-MOOC: un système de recommandation pour la personnalisation du processus d'échange d'informations dans les MOOCs
37,10.26847,4.9544477,pdf_37.txt,2018,fr,"Marie Al Ghossein, Talel Abdessalem, Anthony Barré",L'exploitation de données contextuelles pour la recommandation d'hôtels
38,-23.169497,-6.2326684,pdf_38.txt,2018,fr,"Claire Nédellec, Estelle Chaix, Robert Bossy, Louise Deléger, Sandra Dérozier, Jean-Baptiste Bohuon, Valentin Loux",L'ontologie OntoBiotope pour l'étude de la biodiversité microbienne
39,-25.712955,31.30225,pdf_39.txt,2018,fr,Ernesto Estrada,Long-range influences in (social) networks
40,13.514017,13.119605,pdf_40.txt,2018,fr,"Haolin Ren, Marie-Luce Viaud, Guy Melançon",Mainmise sur les médias et suivi de communautés dans les graphes dynamiques
41,-21.750385,35.67947,pdf_41.txt,2018,fr,"Gaël Beck, Hanane Azzag, Mustapha Lebbah, Tarn Duong",Mean-shift : Clustering scalable et distribué
42,4.977986,-5.986208,pdf_42.txt,2018,fr,"Rostand Affogbolo, Claire Gauzente, Alain Guénoche, Pascale Kuntz",Méta-analyse ordinale d'enquêtes d'opinion Application aux usages de l'Internet des objets en entreprise
43,9.570737,3.021249,pdf_43.txt,2018,fr,"Sarra Bouzayane, Inès Saad",Méthode basée sur les ensembles approximatifs pour l'apprentissage incrémental en présence des données déséquilibrées
44,-11.898953,25.273384,pdf_44.txt,2018,fr,"Thi-Bich-Ngoc Hoang, Josiane Mothe",Méthode d'Apprentissage pour Extraire les Localisations dans les MicroBlogs
45,-6.9890003,-6.8469596,pdf_45.txt,2018,fr,"Iuri D. Nogueira, Maram Romdhane, Jérôme Darmont",Modélisation des métadonnées d'un data lake en data vault
46,-18.9949,6.3225703,pdf_46.txt,2018,fr,"Haikel Megrahi, Nouha Omrane, Rakia Jaziri",NFB: protocole de Notarisation des Documents dans la Blockchain
47,5.1357737,-0.4379077,pdf_47.txt,2018,fr,"Zaineb Chelly Dagdia, Christine Zarges, Gaël Beck, Mustapha Lebbah",Nouveau Modèle de Sélection de Caractéristiques basé sur la Théorie des Ensembles Approximatifs pour les Données Massives
48,24.41679,11.348581,pdf_48.txt,2018,fr,"Erick Stattner, Reynald Eugenie, Martine Collard",PALM: Un algorithme parallèle pour extraire des clusters de liens dans les réseaux sociaux
49,-2.9420946,-7.995986,pdf_49.txt,2018,fr,"Robin Brochier, Adrien Guille, Julien Velcin, Benjamin Rothan, François Di Cioccio",Peerus Review: Un outil de recherche d'experts scientifiques
50,-0.01572344,4.3801775,pdf_50.txt,2018,fr,"Colin Leverger, Régis Marguerie, Vincent Lemaire, Thomas Guyet, Simon Malinowski",PerForecast : un outil de prévision de l'évolution de séries temporelles pour le planning capacitaire
51,7.9288087,-9.300722,pdf_51.txt,2018,fr,"Pierrick Bruneau, Philippe Pinheiro, Yoann Didry",Prédiction du Rayonnement Solaire par Apprentissage Automatique
52,2.0582454,-31.790512,pdf_52.txt,2018,fr,"Jannaï Tokotoko, Frédéric Flouvat, Claire Goiran, Laetitia Hédouin, Antoine Collin, Nazha Selmaoui-Folcher",Prétraitement de données spatialement imprécises pour une classification supervisée basée sur les images satellitaires
53,-8.274436,-0.3541971,pdf_53.txt,2018,fr,"Pascal Cuxac, Nicolas Kieffer",Prise en compte de la structure des documents pour une indexation performante
54,3.5246694,-13.424663,pdf_54.txt,2018,fr,"Alexandre Blansché, Xavier Mazur",Propositions pour améliorer une méthode de prédiction du succès d'une campagne de financement participatif
55,-2.403852,9.064881,pdf_55.txt,2018,fr,Antoine Cornuéjols,Qu'est-ce qu'un bon système d'apprentissage ? La réponse a évolué avec le temps. Et demain?
56,-26.72771,37.088005,pdf_56.txt,2018,fr,"Haithem Ghorbel, Nouha Othman, Rim Faiz",Recommendation-based Keyword Search over Relational Databases
57,-15.041723,11.544206,pdf_57.txt,2018,fr,Christopher Kermorvant,Reconnaissance et indexation automatique des registres de la chancellerie française (1300-1483)
58,-25.367964,37.691948,pdf_58.txt,2018,fr,"Md Shadman Rafid, Mohammad Mazedul Islam, Md Naimul Hoque, Chowdhury Farhan Ahmed",Reframing for Non-Linear Dataset Shift
59,10.388919,-10.503054,pdf_59.txt,2018,fr,"Vivien Kraus, Khalid Benabdeslem, Frederic Cherqui",Régression Laplacienne semi-supervisée pour la reconstitution des dates de pose des réseaux d'assainissement
60,5.1963577,-8.289952,pdf_60.txt,2018,fr,"Salma Chaieb, Véronique Delcroix, Ali Ben Mrad, Emmanuelle Grislin-Le Strugeon",Réseau bayésien pour la gestion de l'obsolescence dans une base d'informations en vue de l'évaluation du risque de chute des personnes âgées
61,-25.694288,-11.520497,pdf_61.txt,2018,fr,"Roberto Marroquin, Julien Dubois, Christophe Nicolle",Savoir au dela de voir: vision artificielle et raisonnement logique
62,-22.864899,-6.4942026,pdf_62.txt,2018,fr,"Emna Amdouni, Bernard Gibaud",Sémantique des données d'observation en neuro-imagerie selon un point de vue réaliste
63,-28.795033,36.712376,pdf_63.txt,2018,fr,"Gamze Saygi, Jean-Yves Blaise, Iwona Dudek",Temporal hints in the cultural heritage discourse: what can an ontology of time as it is worded reveal?
64,20.894775,-24.437654,pdf_64.txt,2018,fr,"Aichetou Bouchareb, Marc Boullé, Fabrice Rossi, Fabrice Clérot",Un modèle Bayésien de co-clustering de données mixtes
65,9.570737,3.021249,pdf_65.txt,2018,fr,"Hemza Ficel, Mohamed Ramzi Haddad, Hajer Baazaoui Zghal",Une approche sémantique hybride pour la recommandation des articles d'actualité à large échelle
66,-7.051765,13.185041,pdf_66.txt,2018,fr,"Luciano Gervasoni, Serge Fenet, Peter Sturm",Une méthode pour l'estimation désagrégée de données de population à l'aide de données ouvertes
67,-8.926262,5.747998,pdf_67.txt,2018,fr,"Tita Kyriacopoulou, Claude Martineau, Cristian Martinez",UNITEX/GRAMLAB: plateforme libre basée sur des lexiques et des grammaires pour le traitement des corpus textuels
68,-0.77370447,11.049903,pdf_68.txt,2018,fr,"Thomas Raimbault, Abdellah Sabry, Sonia Djebali",Universal-endpoint.com : une plateforme d'accès simple au Web des Données
69,-10.325143,-23.396116,pdf_69.txt,2018,fr,"Clément Christophe, Julien Velcin, Manel Boumghar",Utilisation de techniques de modélisation thématiques pour la détection de nouveauté dans des flux de données textuelles.
70,6.508794,11.155503,pdf_70.txt,2018,fr,"Rabia Azzi, Sylvie Desprès, Jérôme Nobécourt",Visualisation dynamique de connaissances : application aux interactions entre facteurs de risque des maladies cardiovasculaires
71,-28.017128,38.4404,pdf_71.txt,2017,fr,"Ioannis Partalas, Cédric Lopez, Pierre-Alain Avouac, Matthieu Osmuk, Domoina Rabarijaona, Dana Popovici, Frédérique Segond",A Hybrid Approach for Detecting Influencers in Social Media
72,7.0962615,-33.96921,pdf_72.txt,2017,fr,"Lynda Khiali, Dino Ienco, Maguelonne Teisseire",Analyse des dynamiques spatio-temporelles à partir de séries temporelles d'images satellitaires
73,-12.271651,-8.714404,pdf_73.txt,2017,fr,"Nicolas Médoc, Mohammad Ghoniem, Mohamed Nadif",Analyse exploratoire de corpus textuels pour le journalisme d'investigation
74,25.236319,-22.110872,pdf_74.txt,2017,fr,"Françoise Fessant, Tarek Benkhelif, Fabrice Clérot",Anonymiser des données multidimensionnelles à l'aide du coclustering
75,24.952175,-23.011616,pdf_75.txt,2017,fr,"Aichetou Bouchareb, Marc Boullé, Fabrice Clérot, Fabrice Rossi",Application du coclustering à l'analyse exploratoire d'une table de données
76,-4.635976,6.586658,pdf_76.txt,2017,fr,"Pierre-René Lhérisson, Fabrice Muhlenbach, Pierre Maret",Application mobile pour l'évaluation d'un algorithme de calcul de distance entre des items musicaux
77,-2.0180686,-18.342447,pdf_77.txt,2017,fr,"Gaëtan Caillaut, Guillaume Cleuziou",Apprentissage d'espaces prétopologiques dans un cadre multi-instance pour la structuration de données
78,-10.446462,-14.648605,pdf_78.txt,2017,fr,"Oussama Ahmia, Nicolas Béchet, Pierre-François Marteau",Apprentissage de structures séquentielles pour l'extraction d'entités et de relations dans des textes d'appels d'offres
79,3.926214,-2.0788774,pdf_79.txt,2017,fr,"Roland Kotto-Kombi, Nicolas Lumineau, Phillipe Lamarre",Approche préventive pour une gestion élastique du traitement parallèle et distribué de flux de données
80,8.459624,-6.3113003,pdf_80.txt,2017,fr,"William Raynaut, Chantal Soulé-Dupuy, Nathalie Vallès-Parlangeau",Cadre d'Evaluation pour la Méta Analyse de Données
81,10.925745,-22.115208,pdf_81.txt,2017,fr,"Julien Ah-Pine, Xinyu Wang",Classification ascendante hiérarchique à noyaux et une application aux données textuelles
82,12.992056,-26.810802,pdf_82.txt,2017,fr,"François Meunier, Christophe Marsala, Laurent Castanié, Bruno Conche",Classification d'objets 3D par extraction aléatoire de sous-parties discriminantes pour l'étude du sous-sol en prospection pétrolière
83,28.930193,-12.352817,pdf_83.txt,2017,fr,"Khalil Laghmari, Christophe Marsala, Mohammed Ramdani",Classification multi-labels graduée: Apprendre les relations entre les labels ou limiter la propagation d'erreur ?
84,2.1504252,-36.488655,pdf_84.txt,2017,fr,"Ayoub Karine, Abdelmalek Toumi, Ali Khenchaf, Mohammed El Hassouni",Classification parcimonieuse pour l'aide à la reconnaissance de cibles radar
85,16.665707,-17.428799,pdf_85.txt,2017,fr,"Aichetou Bouchareb, Marc Boullé, Fabrice Rossi",Co-clustering de données mixtes à base des modèles de mélange
86,-25.528852,-19.87751,pdf_86.txt,2017,fr,"Florent Domenach, George Portides",Comparaison et Évaluation de Mesures de Similarité entre Concepts d'un Treillis
87,-8.573522,11.458235,pdf_87.txt,2017,fr,"Emmanuelle Claeys, Pierre Gançarski, Myriam Maumy-Bertrand, Hubert Wassner",Conception d'un modèle généraliste pour l'évaluation d'un test A/B
88,36.68982,2.9471328,pdf_88.txt,2017,fr,"Guillaume Bosc, Jean-François Boulicaut, Chedy Raïssi, Mehdi Kaytoue",Découverte de sous-groupes avec les arbres de recherche de Monte Carlo
89,-20.689064,21.606808,pdf_89.txt,2017,fr,Freddy Lécué,Deep Dive on Smart Cities by Scaling Reasoning and Interpreting the Semantics of IoT
90,24.247137,-11.864464,pdf_90.txt,2017,fr,"Vincent Levorato, Michel Lutz, Matthieu Lagacherie",Défi EGC 2017: Modélisation Cost-Sensitive et Enrichissement de données
91,44.2902,5.379528,pdf_91.txt,2017,fr,"Moditha Hewasinghage, Suela Isaj, Arnaud Giacometti, Arnaud Soulet",Description interactive de l'intérêt de l'utilisateur via l'échantillonnage de motifs
92,3.5164213,-35.739582,pdf_92.txt,2017,fr,"Cédric Maigrot, Vincent Claveau, Ewa Kijak",Détection de fausses informations dans les réseaux sociaux : vers des approches multi-modales
93,-26.061567,39.75809,pdf_93.txt,2017,fr,"Wen Zhang, Raja Chiky, Manuel Pozo",Enhanced user-user collaborative filtering recommendation algorithm based on semantic ratings
94,13.640525,13.083739,pdf_94.txt,2017,fr,"Haolin Ren, Marie-Luce Viaud, Guy Melançon",Evolution temporelle de communautés représentatives : mesures et visualisation
95,-6.8446393,6.9093966,pdf_95.txt,2017,fr,"Jérémy Vizzini, Cyril Labbé, François Portet",Expression des connaissances en langage naturel : singularité et normalité d'une sélection
96,-22.450006,-8.349003,pdf_96.txt,2017,fr,"Anne Toulet, Emmanuel Roux, Anne-Elisabeth Laques, Eric Delaître, Laurent Demagistri, Isabelle Mougenot",Extraction automatique de paysages en imagerie satellitaire et enrichissement sémantique
97,37.01314,-4.2180333,pdf_97.txt,2017,fr,"Yann Dauxais, David Gross-Amblard, Thomas Guyet, André Happe",Extraction de chroniques discriminantes
98,-11.291807,28.034296,pdf_98.txt,2017,fr,"Cédric Lopez, Elena Cabrio, Frédérique Segond",Extraction de relations pour le peuplement d'une base de connaissance à partir de tweets
99,44.09596,7.852831,pdf_99.txt,2017,fr,"Zhi Cheng, Frédéric Flouvat, Nazha Selmaoui-Folcher",Extraction des évolutions récurrentes dans un unique graphe dynamique attribué
100,-7.6178102,0.27029622,pdf_100.txt,2017,fr,"Benjamin Hervy, Matthieu Quantin, Pierre Teissier",Extraction et chaînage supervisés de connaissances d'un corpus d'entretiens en histoire des sciences
101,-21.067255,-7.7028856,pdf_101.txt,2017,fr,"Harold Vilmart, Jean-Claude Léon, Federico Ulliana",Extraction et Inférence de Connaissances à partir d'Assemblages Mécaniques Définis par une Représentation CAO 3D
102,0.38373056,2.0763555,pdf_102.txt,2017,fr,"Adrien Dufraux, Benjamin Renoust, Shin’Ichi Satoh",Face2Graph: Base de données graphe et visualisation pour l'annotation d'archives vidéos
103,-4.979888,-7.6692395,pdf_103.txt,2017,fr,"Pierrick Bruneau, Olivier Parisot, Thomas Tamisier",Faciliter les contributions personnelles pour préserver la mémoire des événements historiques
104,-0.32472754,11.468787,pdf_104.txt,2017,fr,"Maxime Lefrançois, Antoine Zimmermann, Noorani Bakerally",Génération de RDF à partir de sources de données aux formats hétérogènes
105,1.9281518,-0.8278531,pdf_105.txt,2017,fr,"Badre Belabbess, Jérémy Lhez, Olivier Curé",Gestion de Connaissances en Temps Réel depuis des Flux Massifs de Données et Apprentissage Automatique
106,-6.099787,-14.789325,pdf_106.txt,2017,fr,Maxime Lefrançois,Interopérabilité sémantique libérale pour les services et les objets
107,11.450719,-16.552832,pdf_107.txt,2017,fr,"Brieuc Conan-Guez, Alain Gély, Lydia Boudjeloud-Assala, Alexandre Blansché",K-Spectral Centroïd pour des données massives
108,-23.223574,38.05593,pdf_108.txt,2017,fr,"Mohamed Guendouz, Abdelmalek Amine, Reda Mohamed Hamou",Machine Learning Based Classification of Android Apps through Text Features
109,-26.429075,28.89158,pdf_109.txt,2017,fr,Claudia d’Amato,Machine Learning for the Semantic Web: filling the gaps in Ontology Mining
110,0.79454225,18.98662,pdf_110.txt,2017,fr,"Benjamin Costé, Cyril Ray, Gouenou Coatrieux",Mesure de la confiance dans les systèmes d'information : application aux données de navires
111,-2.3712413,-23.422125,pdf_111.txt,2017,fr,Florent Domenach,Mesure de Similarité entre Treillis Basée sur des Correspondances Explicites
112,-3.6313045,10.540138,pdf_112.txt,2017,fr,"Hippolyte Léger, Dominique Bouthinon, Mustapha Lebbah, Hanane Azzag",Nouveau modèle pour un passage à l'échelle de la 0-subsomption
113,13.541119,0.57898545,pdf_113.txt,2017,fr,"Mohamed Boussahoua, Omar Boussaid",Optimisation des performances dans les entrepôts de données NoSQL en colonnes
114,-10.356948,15.389283,pdf_114.txt,2017,fr,"Damien Leprovost, Marie-Christine Jaulent",Pharmacovigilance du Web Social par une approche fondée sur les bases de connaissances du Web Sémantique
115,-17.347765,33.88111,pdf_115.txt,2017,fr,"Bruno Pinaud, Oana Andrei, Maribel Fernández, Hélène Kirchner, Guy Melançon, Jason Vallet",PORGY : a Visual Analytics Platform for System Modelling and Analysis Based on Graph Rewriting
116,24.301008,-11.736774,pdf_116.txt,2017,fr,"Yelen Per, Kevin Dalleau, Malika Smail-Tabbone",Prédiction de défauts dans les arbres du parc végétal Grenoblois et préconisations pour les futures plantations
117,3.4521182,-13.397429,pdf_117.txt,2017,fr,"Alexandre Blansché, Dylan Da Conceicao, Dylan Koby",Prédiction du montant levé lors d'une campagne de financement participatif par la méthode des plus proches voisins
118,4.920061,-9.048113,pdf_118.txt,2017,fr,"Jérémy Roos, Stéphane Bonnevay, Gérald Gavin",Prévision à court terme des flux de voyageurs du réseau ferré urbain : une approche par les réseaux bayésiens dynamiques
119,8.563406,-20.236115,pdf_119.txt,2017,fr,"Adnan El Moussawi, Philippe De Guis, Arnaud Giacometti, Nicolas Labroche, Arnaud Soulet",Prototype de clustering exploratoire pour l'aide à la segmentation des clients
120,-4.4518976,6.6058416,pdf_120.txt,2017,fr,"Pierre-René Lhérisson, Fabrice Muhlenbach, Pierre Maret",Recommandations et prédictions de préférences basées sur la combinaison de données sémantiques et de folksonomie
121,-8.9644375,-16.006569,pdf_121.txt,2017,fr,"Gildas Tagny Ngompé, Sébastien Harispe, Guillaume Zambrano, Jacky Montmain, Stéphane Mussard",Reconnaissance de sections et d'entités dans les décisions de justice : application des modèles probabilistes HMM et CRF
122,1.3730414,-35.561024,pdf_122.txt,2017,fr,"Olfa Allani, Nedra Mellouli, Hajer Baazaoui , Herman Akdag",Sélection ciblée des descripteurs visuels pour la recherche d'images: une approche basée sur les règles d'association
123,28.030094,-13.164062,pdf_123.txt,2017,fr,"Sènami C Fréjus Ahomagnon, Nicolas Voisine, Marc Boullé",Sélection et transformation de variables pour la classification Multi-Label par une approche MDL
124,8.51905,-18.540937,pdf_124.txt,2017,fr,"Ibrahim Louhi, Lydia Boudjeloud-Assala, Thomas Tamisier",Subspace Clustering et Visualisation des Flux de Données
125,-20.771444,13.282815,pdf_125.txt,2017,fr,"Erick Stattner, Martine Collard",Suivi de l'évolution de Clusters de Liens dans des Réseaux Sociaux Dynamiques
126,-0.45976323,11.522625,pdf_126.txt,2017,fr,"Maxime Lefrançois, Antoine Zimmermann",Support uniforme de types de données personnalisés dans RDF et SPARQL
127,4.4483943,-31.572956,pdf_127.txt,2017,fr,"Andrés Troya-Galvis, Pierre Gançarski, Isabelle Mougenot, Laure Berti-Equille",Sur l'évaluation et l'élaboration d'un jeu de données de référence de bonne qualité en télédétection
128,16.135963,-25.105694,pdf_128.txt,2017,fr,"Oumaima Alaoui Ismaili, Vincent Lemaire, Antoine Cornuéjols",Un critère d'évaluation pour les K-moyennes prédictives
129,14.833138,12.516021,pdf_129.txt,2017,fr,"Oualid Benyahia, Christine Largeron, Baptiste Jeudy, Osmar R. Zaïane",Un générateur de réseaux dynamiques attribués avec structure communautaire
130,11.275285,5.057319,pdf_130.txt,2017,fr,"Jean-Benoît Griesner, Talel Abdesssalem, Hubert Naacke",Un Modèle de Factorisation de Poisson pour la Recommandation de Points d'Intérêt
131,41.843132,3.2629468,pdf_131.txt,2017,fr,"Jerry Lonlac, Yannick Miras, Aude Beauger, Marie Pailloux, Jean-Luc Peiry , Engelbert Mephu Nguifo",Une Approche d'Extraction de Motifs Graduels (Fermés) Fréquents Sous Contrainte de la Temporalité
132,-10.951121,16.344673,pdf_132.txt,2017,fr,"Didier Henry, Erick Stattner, Martine Collard",Une approche innovante pour la compréhension des comportements de diffusion : personnalité et neutralité
133,28.736668,3.021391,pdf_133.txt,2017,fr,"Abdelhamid Boudane, Said Jabbour, Lakhdar Sais, Yakoub Salhi",Une approche logique pour la fouille de règles d'association
134,-11.932358,13.141659,pdf_134.txt,2017,fr,Dominique Cardon,Une approche sociologique de la place des calculs dans les mondes numériques
135,1.4305936,-7.875131,pdf_135.txt,2017,fr,"Hosna Ouni, Arnaud Martin, Laetitia Gros, Mouloud Kharoune, Zoltan Miklos",Une mesure d'expertise pour le crowdsourcing
136,13.9267235,11.409488,pdf_136.txt,2017,fr,"Nicolas Dugué, Jean-Charles Lamirel",Une métrique de sélection de variables appliquée à la centralité et à la détection des rôles communautaires
