,0,1,pdf_names,year,language,authors,title
859,6.5109124,2.4901333,pdf_859.txt,2008,fr,"Virginie Lefort, Guillaume Beslon",Optimisation incrémentale de réseaux de neurones RBF pour la régression via un algorithme évolutionnaire : RBF-Gene
860,20.5651,-20.664892,pdf_860.txt,2008,fr,"Nistor Grozavu, Younès Bennani, Mustapha Lebbah",Pondération locale des variables en apprentissage numérique non-supervisé
861,14.255788,17.602037,pdf_861.txt,2008,fr,"Frédéric Pennerath, Géraldine Polaillon, Amedeo Napoli",Prétraitement des bases de données de réactions chimiques pour la fouille de schémas de réactions
862,11.945519,-5.2960076,pdf_862.txt,2008,fr,Edwin Diday,Principes d'Analyse des données symboliques et application à la détection d'anomalies sur des ouvrages publics
863,-12.192708,17.980719,pdf_863.txt,2008,fr,"Vladislav Matviico, Nicolas Muret, Mathieu Roche",Processus d'acquisition d'un dictionnaire de sigles et de leurs définitions à partir d'un corpus
864,1.6548047,-3.0845792,pdf_864.txt,2008,fr,"Imen Brahmi, Sadok Ben Yahia, Yahya Slimani",Proposition d'une nouvelle approche de détection d'intrusions basée sur les règles associatives génériques de classification
865,6.3821096,16.357466,pdf_865.txt,2008,fr,"Sandro Bimonte,  Anne Tchounikine, Maryvonne Miquel, Robert Laurini",Proposition pour l'intégration de l'analyse spatiale et de l'analyse multidimensionnelle
866,-13.220613,16.04571,pdf_866.txt,2008,fr,"Mohamed Elati, Céline Rouveirol",Recherche adaptative de structures de régulation génétique
867,7.8282332,-35.751724,pdf_867.txt,2008,fr,"Philippe-Henri Gosselin, Justine Lebrun, Sylvie Philipp-Foliguet",Recherche d'images par noyaux sur graphes de régions
868,-10.782263,-7.4163265,pdf_868.txt,2008,fr,"Thanh-Trung Van, Michel Beigbeder",Recherche d'information personnalisée dans les bibliothèques numériques scientifiques
869,37.55201,2.3423712,pdf_869.txt,2008,fr,"Marc Joliveau, Florian De Vuyst",Recherche de motifs spatio-temporels de cas atypiques pour le trafic routier urbain
870,-5.007311,-4.452788,pdf_870.txt,2008,fr,"Christine Froidevaux, Frédéric Lemoine",Requêtes alternatives dans le contexte d'un entrepôt de données génomiques
871,19.30743,-19.12638,pdf_871.txt,2008,fr,"Mustapha Lebbah, Hanane Azzag",Segmentation hiérarchique des cartes topologiques
872,-25.405708,34.18264,pdf_872.txt,2008,fr,"Yi Yu, Talel Abdessalem",Semantics of Spatial Window over Spatio-Temporal Data Stream
873,-27.941116,-13.785222,pdf_873.txt,2008,fr,"Sylvie Desprès, Sylvie Szulman",Sémantique et Réutilisation d'ontologie générique
874,-10.962555,-22.030975,pdf_874.txt,2008,fr,"Mimoun Malki, Abdelmalek Amine, Zakaria Elberrichi, Michel Simonet",SOM pour la Classification Automatique Non supervisée de Documents Textuels basés sur Wordnet
875,7.016627,-13.623006,pdf_875.txt,2008,fr,"Alzennyr Da Silva, Yves Lechevallier",Stratégies de classification non supervisée basées sur fenêtres superposées : application aux données d'usage du Web
876,-16.65858,23.361645,pdf_876.txt,2008,fr,"Dan A. Simovici, Saaid Baraty",Structure Inference of Bayesian Networks from Data: A New Approach Based on Generalized Conditional Entropy
877,30.931707,8.978602,pdf_877.txt,2008,fr,Viet Phan Luong,Suppression des Itemsets Clés Non Essentiels en Classification basée sur les Règles d'Association
878,3.7389607,22.55398,pdf_878.txt,2008,fr,"Inès Saad, Imène Brigui-Chtioui",Système multi-agent argumentatif pour la classification des connaissances cruciales
879,17.83277,-21.22881,pdf_879.txt,2008,fr,"Guénaël Cabanes, Younès Bennani",Un algorithme de classification topographique non supervisée à deux niveaux simultanés
880,4.3110332,13.378605,pdf_880.txt,2008,fr,"Sébastien Caquard, Jean-Pierre Fiset",Un cyber cartogramme gravitationnel pour l'analyse visuelle de données spatiotemporelles complexes
881,-16.18506,-20.184309,pdf_881.txt,2008,fr,Sujeevan Aseervatham,Un modèle d'espace vectoriel de concepts pour noyaux sémantiques
882,-28.23334,-13.198244,pdf_882.txt,2008,fr,"Gilles Falquet, Claire-Lise Mottaz Jiang, Jacques Guyot",Un modèle et une algèbre pour les systèmes de gestion d'ontologies
883,-4.886936,9.033834,pdf_883.txt,2008,fr,"Rachid Elmeziane, Ilham Berrada, Ismail Kassou",Un nouveau système immunitaire artificiel pour l'apprentissage non supervisé
884,-14.7378025,-1.4941152,pdf_884.txt,2008,fr,"Khaoula Mahmoudi, Sami Faiz",Un processus d'acquisition d'information pour les besoins de l'enrichissement des BDG
885,-8.829259,-21.354115,pdf_885.txt,2008,fr,"Michel Plantié, Mathieu Roche, Gérard Dray",Un système de vote pour la classification de textes d'opinion
886,-28.415905,-5.6095233,pdf_886.txt,2008,fr,"François-Élie Calvier, Chantal Reynaud",Une aide à la découverte de mappings dans SomeRDFS
887,15.052943,-24.825197,pdf_887.txt,2008,fr,"Romain Billot, Henri-Maxime Suchier, Stéphane Lallich",Une approche ensembliste inspirée du boosting en classification non supervisée
888,-21.75096,-10.515962,pdf_888.txt,2008,fr,"Anastasiya Yurchyshyna, Catherine Faron-Zucker, Nhan Le Thanh, Celson Lima",Une approche ontologique pour automatiser le contrôle de conformité dans le domaine du bâtiment
889,37.310047,-6.2563133,pdf_889.txt,2008,fr,"Marc Le Goc, Nabil Benayadi",Une J-mesure orientée pour élaguer des modèles de chroniques
890,-26.056292,-20.135458,pdf_890.txt,2008,fr,"Saoussen Sakji, Marie-Aude Aufaure, Géraldine Polaillon, Bénédicte Le Grand, Michel Soto",Une mesure de similarité contextuelle pour l'aide à la navigation dans un treillis
891,12.172796,-12.209249,pdf_891.txt,2008,fr,"Emna Bahri, Mondher Maddouri",Une nouvelle approche du boosting face aux données bruitées
892,15.111588,-12.037369,pdf_892.txt,2008,fr,"Nathanaël Kasoro, André Hardy",Une nouvelle méthode divisive en classification non supervisée pour des données symboliques intervalles
893,-12.082267,-13.963418,pdf_893.txt,2008,fr,Mouna Kamel,Une proposition pour l'extraction de relations non prédicatives
894,-26.510473,-13.930849,pdf_894.txt,2008,fr,"Bassem Makni, Khaled Khelif, Rose Dieng-Kuntz, Hacène Cherfi",Utilisation du Web Sémantique pour la gestion d'une liste de diffusion d'une CoP
895,28.031721,-1.737886,pdf_895.txt,2008,fr,"Ansaf Salleb-Aouissi, Bert C. Huang, David L. Waltz",Vers des Machines à Vecteurs de Support “Actionnables” : Une Approche Fondée sur le Classement
896,24.003454,-25.0962,pdf_896.txt,2008,fr,"Raphaël Feraud, Marc Boullé, Fabrice Clérot, Françoise Fessant",Vers l'exploitation de grandes masses de données
897,7.4023256,-10.064886,pdf_897.txt,2008,fr,"Anouck Bodin-Niemczuk, Riadh Ben Messaoud, Sabine Loudcher, Omar Boussaid",Vers l'intégration de la prédiction dans les cubes OLAP
898,-19.132492,-13.297643,pdf_898.txt,2008,fr,"Nizar Ghoula, Khaled Khelif, Rose Dieng-Kuntz",Vers une fouille sémantique des brevets : Application au domaine biomédical
899,42.223175,4.94724,pdf_899.txt,2008,fr,"Julien Rabatel, Yuan Lin, Yoann Pitarch, Hassan Saneifar, Claire Serp, Mathieu Roche, Anne Laurent",Visualisation des motifs séquentiels extraits à partir d'un corpus en Ancien Français
900,38.147266,-8.271259,pdf_900.txt,2008,fr,"Nicolas S. Müller, Sylvain Lespinats, Gilbert Ritschard, Matthias Studer, Alexis Gabadinho",Visualisation et classification des parcours de vie
901,5.5369205,-24.452765,pdf_901.txt,2008,fr,"Malika Charrad, Yves Lechevallier, Gilbert Saporta, Mohamed Ben Ahmed",Web Content Data Mining : la classification croisée pour l'analyse textuelle d'un site Web
902,-29.32231,-14.826675,pdf_902.txt,2007,fr,"Valentina Ceausu, Sylvie Desprès",Alignement de ressources sémantiques à partir de règles
903,-16.632257,-5.8509817,pdf_903.txt,2007,fr,"Bernardo Lopez, Samira Hammiche, Samir Sebahi, Mohand-Said Hacid",Annotation et navigation de données archéologiques
904,-21.599304,-13.982042,pdf_904.txt,2007,fr,"Gaëlle Hignette, Patrice Buche, Juliette Dibie-Barthélemy, Ollivier Haemmerlé",Annotation sémantique floue de tableaux guidée par une ontologie
905,23.307697,-18.638247,pdf_905.txt,2007,fr,"Alexandre Aussem, Sergio Rodrigues de Morais, Marilys Corbex",Application des réseaux bayésiens à l'analyse des facteurs impliqués dans le cancer du Nasopharynx
906,-20.786549,-17.30502,pdf_906.txt,2007,fr,"Frédéric Triou, Fabien Picarougne, Henri Briand",Apport du Web sémantique dans la réalisation d'un moteur de recherche géo-localisé à usage des entreprises
907,12.6650715,-14.309934,pdf_907.txt,2007,fr,"Alexis Bondu, Vincent Lemaire, Barbara Poulain",Apprentissage actif d'émotions dans les dialogues Homme-Machine
908,14.319051,-18.674238,pdf_908.txt,2007,fr,"Tuong-Vinh Truong, Massih-Reza Amini",Apprentissage semi-supervisé de fonctions d'ordonnancement
909,17.43921,-15.237414,pdf_909.txt,2007,fr,"Pierre Gaillard, Michaël Aupetit, Gérard Govaert",Apprentissage statistique de la topologie d'un ensemble de données étiquetées
910,22.129791,-19.046215,pdf_910.txt,2007,fr,"Khalid Benabdeslem, Mustapha Lebbah, Alexandre Aussem, Marilys Corbex",Approche connexionniste pour l'extraction de profils cas-témoins du cancer du Nasopharynx à partir des données issues d'une étude épidémiologique
911,-26.836605,-3.2211134,pdf_911.txt,2007,fr,"Fatiha Saïs, Nathalie Pernelle, Marie-Christine Rousset",Approche logique pour la réconciliation de références
912,5.1852007,9.758997,pdf_912.txt,2007,fr,"Noel Novelli, David Auber",Calcul et représentation efficace de cubes de données pour une visualisation orientée pixel
913,-7.240642,16.986835,pdf_913.txt,2007,fr,"Didier Devaurs, Fabien De Marchi, Mohand-Said Hacid",Caractérisation des transitions temporisées dans les logs de conversation de services Web
914,-18.027374,-3.382932,pdf_914.txt,2007,fr,"Marc Boyer, Marie-Françoise Canut, Max Chevalier, André Péninou, Florence Sedes",Cartographie de l'organisation : une approche topologique des connaissances
915,26.780985,0.6165518,pdf_915.txt,2007,fr,"Vincent Pisetta, Gilbert Ritschard, Djamel Abdelkader Zighed",Choix des conclusions et validation des règles issues d'arbres de classification
916,-13.250988,-24.634575,pdf_916.txt,2007,fr,"Faiza Abbaci, Pascal Francq",Classement des fragments de documents XML par une méthode d'aide à la décision
917,10.839727,-11.794981,pdf_917.txt,2007,fr,"Etienne Cuvelier, Monique Noirhomme-Fraiture",Classification de fonctions continues à l'aide d'une distribution et d'une densité définies dans un espace de dimension infinie
918,15.283779,-30.837763,pdf_918.txt,2007,fr,"Thanh-Nghi Do, François Poulet",Classification de grands ensembles de données avec un nouvel algorithme de SVM
919,43.48815,3.4204755,pdf_919.txt,2007,fr,"Rabie Saidi, Mondher Maddouri, Engelbert Mephu Nguifo",Classification supervisée de séquences biologiques basée sur les motifs et les matrices de substitution
920,-20.575941,35.069244,pdf_920.txt,2007,fr,Hans-Hermann Bock,Clustering : from model-based approaches to heuristic algorithms
921,18.728632,-19.477018,pdf_921.txt,2007,fr,"Mohamed Ramzi Temanni, Mustapha Lebbah, Christine Poitou-Bernert, Karine Clément, Jean-Daniel Zucker",Combinaison des cartes topologiques mixtes et des machines à vecteurs de support : une application pour la prédiction de perte de poids chez les obèses
922,-20.373425,-3.3028,pdf_922.txt,2007,fr,"L'Hédi Zaher, Jean-Pierre Cahier, Christophe Lejeune, Manuel Zacklad",Construction coopérative de carte de thèmes : vers une modélisation de l'activité socio-sémantique
923,-26.429232,-18.507185,pdf_923.txt,2007,fr,"Amedeo Napoli, Yannick Toussaint, Rokia Bendaoud",Construction d'ontologie à partir de corpus de textes
924,6.172511,-23.616495,pdf_924.txt,2007,fr,"Alzennyr Da Silva, Yves Lechevallier, Fabrice Rossi, Francisco de Assis Tenório de Carvalho",Construction et analyse de résumés de données évolutives : application aux données d'usage du Web
925,16.622139,15.741899,pdf_925.txt,2007,fr,"Julien Lavergne, Hanane Azzag, Christiane Guinot, Gilles Venturini",Construction incrémentale et visualisation de graphes de voisinage par des fourmis artificielles
926,37.91339,-5.6846714,pdf_926.txt,2007,fr,"Nabil Benayadi, Marc Le Goc, Philippe Bouché",Découverte de chroniques à partir de séquences d'événements pour la supervision de processus dynamiques
927,0.42183363,15.135741,pdf_927.txt,2007,fr,"Aliou Boly, Sabine Goutier, Georges Hébrail",Des fonctions d'oubli intelligentes dans les entrepôts de données
928,-4.069668,8.395406,pdf_928.txt,2007,fr,"Rachid El Meziane, Ilham Berrada, Ismail Kassou, Karim Baïna",Détermination du niveau de consommation des abonnés en téléphonie mobile par la théorie des ensembles flous
929,18.39788,-20.473667,pdf_929.txt,2007,fr,"Elie Prudhomme, Stéphane Lallich",Ensemble prédicteur fondé sur les cartes auto-organisatrices adapté aux données volumineuses
930,15.10928,-12.541113,pdf_930.txt,2007,fr,"Marie Chavent, Yves Lechevallier",Evaluation d'une approche de classification conceptuelle
931,22.304401,-25.485106,pdf_931.txt,2007,fr,"Sylvain Ferrandiz, Marc Boullé",Evaluation supervisée de métrique : application à la préparation de données séquentielles
932,-26.641815,-12.306205,pdf_932.txt,2007,fr,"Phuc-Hiep Luong, Rose Dieng-Kuntz, Alain Boucher",Evolution de l'ontologie et gestion des annotations sémantiques inconsistantes
933,-14.4134445,-21.413082,pdf_933.txt,2007,fr,"Zoulikha Heddadji, Nicole Vincent, Séverine Kirchner, Georges Stamon",Extension sémantique du modèle de similarité basé sur la proximité floue des termes
934,-8.906012,-16.160397,pdf_934.txt,2007,fr,"Thierry Despeyroux, Eduardo Fraschini, Anne-Marie Vercoustre",Extraction d'entités dans des collections évolutives
935,34.525654,3.5198002,pdf_935.txt,2007,fr,"Amedeo Napoli, Jean Lieber, Fadi Badra",Extraction de connaissances d'adaptation par analyse de la base de cas
936,24.599365,4.3003926,pdf_936.txt,2007,fr,"Fabrice Estievenart, Jean-Roch Meurisse",Extraction de données sur Internet avec Retroweb
937,43.253345,-1.5120122,pdf_937.txt,2007,fr,"Marc Plantevit, Anne Laurent, Maguelonne Teisseire",Extraction de séquences multidimensionnelles convergentes et divergentes
938,45.71458,3.95802,pdf_938.txt,2007,fr,"Arnaud Soulet, Bruno Crémilleux",Extraction des Top-k Motifs par Approximer-et-Pousser
939,7.1224957,-7.042574,pdf_939.txt,2007,fr,"Abdelmajid Ben Hamadou, Mohamed Hammami, Radhouane Guermazi",Filtrage des sites Web à caractère violent par analyse du contenu textuel et structurel
940,-20.768885,32.210064,pdf_940.txt,2007,fr,Bart Goethals,Finding interesting queries in relational databases
941,3.7169447,-35.330166,pdf_941.txt,2007,fr,"Filip Florea, Valeriu Cornea, Alexandrina Rogozan, Abdelaziz Bensrhair, Stéfan Jacques Darmoni",Fusion des approches visuelles et contextuelles pour l'annotation des images médicales
942,-9.72697,2.980853,pdf_942.txt,2007,fr,"Cédric Vidrequin, Juan-Manuel Torres-Moreno, Jean-Jacques Schneider, Marc El-Bèze",Génération et enrichissement automatique de listes de patrons de phrases pour les moteurs de questions-réponses
943,18.388527,1.5371855,pdf_943.txt,2007,fr,"Cécile Favre, Fadila Bentayeb, Omar Boussaid",Intégration des connaissances utilisateurs pour des analyses personnalisées dans les entrepôts de données évolutifs
944,-22.86385,32.28051,pdf_944.txt,2007,fr,Howard J. Hamilton,Interestingness in Data Mining
945,12.387627,13.472078,pdf_945.txt,2007,fr,"Caroline Wintergerst, Thomas Ludwig, Danielle Boulanger",L'émergence de connaissances dans les communautés de pratique
946,-14.670812,-1.3884487,pdf_946.txt,2007,fr,"Khaoula Mahmoudi, Sami Faiz",L'outil SDET pour le complètement des données descriptives liées aux bases de données géographiques
947,31.401525,9.635412,pdf_947.txt,2007,fr,"Tarek Hamrouni, Islem Denden, Sadok Ben Yahia, Engelbert Mephu Nguifo, Yahya Slimani",Les itemsets essentiels fermés : une nouvelle représentation concise
948,14.251724,-15.6426935,pdf_948.txt,2007,fr,"Julien Velcin, William Vacher, Jean-Gabriel Ganascia",Logiciel d'aide à l'évaluation des catégorisations
949,18.5471,-10.20594,pdf_949.txt,2007,fr,"Djamel Abdelkader Zighed, Simon Marcellin, Gilbert Ritschard",Mesure d'entropie asymétrique et consistante
950,17.486645,-12.893236,pdf_950.txt,2007,fr,"Julien Thomas, Pierre-Emmanuel Jouve, Nicolas Nicoloyannis","Mesure non symétrique pour l'évaluation de modèles, utilisation pour les jeux de données déséquilibrés"
951,0.96394897,3.8191898,pdf_951.txt,2007,fr,"Hubert Polaert, Philippe Leray, Grégory Mallet",Méthodes statistiques et modèles thermiques compacts
952,-24.63038,-13.734258,pdf_952.txt,2007,fr,"Rémy Brisson, Omar Boussaid, Pierre Gançarski, Anne Puissant, Nicolas Durand",Navigation et appariement d'objets géographiques dans une ontologie
953,-7.6604276,16.866615,pdf_953.txt,2007,fr,"Alexandre Bouchacourt, Luigi Lancieri",Notion de conversation dans les communications interpersonnelles instantanées sur IP
954,13.826576,-23.408651,pdf_954.txt,2007,fr,Guillaume Cleuziou,OKM : une extension des k-moyennes pour la recherche de classes recouvrantes
955,-23.75244,36.360027,pdf_955.txt,2007,fr,"Antonio Irpino, Elvira Romano",Optimal histogram representation of large data sets: Fisher vs piecewise linear approximation
956,15.038039,13.100109,pdf_956.txt,2007,fr,"Romain Boulet, Bertrand Jouve",Partitionnement d'un réseau de sociabilité à fort coefficient de clustering
957,-14.301422,14.883775,pdf_957.txt,2007,fr,Einoshin Suzuki,Peut-on capturer la sémantique à travers la syntaxe ? - découverte des règles d'exception simultanée
958,-6.052708,15.69434,pdf_958.txt,2007,fr,"Nawal Guermouche, Salima Benbernou, Emmanuel Coquery, Mohand-Said Hacid",Préservation de l'Intimité dans les Protocoles de Conversations
959,-16.54618,-12.171614,pdf_959.txt,2007,fr,"Lylia Abrouk, Danièle Hérin",RAS : Un outil pour l'annotation de documents basée sur les liens de citation
960,-14.036813,-25.71756,pdf_960.txt,2007,fr,"Guillaume Wisniewski, Patrick Gallinari",Ré-ordonnancement pour l'apprentissage de transformations de documents HTML
961,8.64446,-32.21251,pdf_961.txt,2007,fr,"Nicolas Verbeke, Nicole Vincent",Réduction de dimension pour l'analyse de données vidéo
962,8.190115,-28.13613,pdf_962.txt,2007,fr,"Hicham Laanaya, Arnaud Martin, Driss Aboutajdine, Ali Khenchaf",Régression floue et crédibiliste par SVM pour la classification des images sonar
963,-8.435615,-18.6372,pdf_963.txt,2007,fr,"Jacques Chauché, Alexandre Labadié",Segmentation thématique par calcul de distance thématique
964,-26.152653,-20.384972,pdf_964.txt,2007,fr,"Michel Soto, Bénédicte Le Grand, Marie-Aude Aufaure",Sémantique et contextes conceptuels pour la recherche d'information
965,27.171253,4.021294,pdf_965.txt,2007,fr,"Jean Diatta, Régis Girard",Sous-bases k-faibles pour des règles d'association valides au sens de la confiance
966,44.490036,0.3736199,pdf_966.txt,2007,fr,"Céline Fiot, Anne Laurent, Maguelonne Teisseire",SPoID : Extraction de motifs séquentiels pour les bases de données incomplètes
967,-23.555424,27.566029,pdf_967.txt,2007,fr,Adrian Tanasescu,SyRQuS - Recherche par combinaison de graphes RDF
968,-3.7216382,-1.983248,pdf_968.txt,2007,fr,"Talel Abdessalem, Raja Chiky, Georges Hébrail, Jean Louis Vitti",Traitement de données de consommation électrique par un Système de Gestion de Flux de Données
969,-3.242476,18.943548,pdf_969.txt,2007,fr,"Mostafa Hanoune, Faouzia Benabbou",Traitement et exploration du fichier Log du Serveur Web pour l'extraction des connaissances : Web Usage Mining
970,-19.371033,-19.146965,pdf_970.txt,2007,fr,"Kévin Ottens, Nathalie Aussenac-Gilles",Un algorithme multi-agent de classification pour la construction d'ontologies dynamiques
971,49.30745,5.422439,pdf_971.txt,2007,fr,"François Jacquenet, Baptiste Jeudy, Christine Largeron",Un cadre théorique pour la gestion de grandes bases de motifs
972,25.254549,5.2341595,pdf_972.txt,2007,fr,"Jean-Marc Petit, Marie Agier",Un outil pour la visualisation de relations entre gènes
973,-14.023857,-12.379671,pdf_973.txt,2007,fr,Thomas Heitz,Un segmenteur de texte en phrases guidé par l'utilisateur
974,9.514657,-8.250261,pdf_974.txt,2007,fr,Sébastien Régis,Une approche de classification non supervisée basée sur la détection de singularités et la corrélation de séries temporelles pour la recherche d'états : application à un bioprocédé fed-batch
975,23.031368,-22.120323,pdf_975.txt,2007,fr,"Marc Boullé, Carine Hue",Une approche non paramétrique Bayésienne pour l'estimation de densité conditionnelle sur les rangs
976,-20.037449,-1.846476,pdf_976.txt,2007,fr,Leoncio Jiménez,Une approche sociotechnique pour le Knowledge Management (KM)
977,6.5127873,2.5035465,pdf_977.txt,2007,fr,"Norbert Tsopzé, Engelbert Mephu Nguifo, Gilbert Tindo",Une étude des algorithmes de construction d'architecture des réseaux de neurones multicouches
978,-8.163922,-5.8502975,pdf_978.txt,2007,fr,"Jacques Le Maitre, Nicolas Faessel",Une extension de XQuery pour la recherche textuelle d'information dans des documents XML
979,25.636269,-24.376966,pdf_979.txt,2007,fr,"Raphaël Feraud, Vincent Lemaire",Une méthode d'interprétation de scores
980,23.987211,-24.180082,pdf_980.txt,2007,fr,Marc Boullé,Une méthode optimale d'évaluation bivariée pour la classification supervisée
981,10.938699,-12.994979,pdf_981.txt,2007,fr,"Le Thi Hoai An, Le Hoai Minh, Pham Dinh Tao",Une nouvelle approche de la programmation DC et DCA pour la classification floue
982,-30.931496,-13.392152,pdf_982.txt,2007,fr,"Sami Zghal, Karim Kamoun, Sadok Ben Yahia, Engelbert Mephu Nguifo",Une nouvelle méthode d'alignement et de visualisation d'ontologies OWL-Lite
983,27.15662,1.2401507,pdf_983.txt,2007,fr,"Régis Gras, Pascale Kuntz, Einoshin Suzuki",Une règle d'exception en Analyse Statistique Implicative
984,-9.790485,0.18586381,pdf_984.txt,2007,fr,"Mohamed Amine Bentaallah, Mimoun Malki",Utilisation de WordNet dans la catégorisation de textes multilingues
985,-5.517235,11.799425,pdf_985.txt,2007,fr,Ludovic Lebart,Validation des visualisations par axes principaux de données numériques et textuelles
986,-16.278082,1.7002659,pdf_986.txt,2007,fr,"Bruno Mermet, Gaële Simon, Dominique Fournier",Vers un algorithme multi-agents de clustering dynamique
987,-22.363575,-8.308709,pdf_987.txt,2007,fr,"Ammar Mechouche, Christine Golbreich, Bernard Gibaud",Vers un système hybride pour l'annotation sémantique d'images IRM du cerveau
988,-23.641403,-11.515044,pdf_988.txt,2007,fr,"Laurent Kevers, Cédrick Fairon",Vers une base de connaissances biographique : extraction d'information et ontologie
989,44.417366,-0.33924496,pdf_989.txt,2007,fr,"Pascal Poncelet, Chedy Raïssi",Vers une nouvelle approche d'extraction des motifs séquentiels non-dérivables
990,28.12381,2.2274752,pdf_990.txt,2007,fr,"Olivier Couturier, Tarek Hamrouni, Sadok Ben Yahia, Engelbert Mephu Nguifo",Vers une plate-forme interactive pour la visualisation de grands ensembles de règles d'association
991,18.471905,14.690098,pdf_991.txt,2007,fr,"David Auber, Yves Chiricota, Maylis Delest, Jean-Philippe Domenger, Patrick Mary, Guy Melançon",Visualisation de graphes avec Tulip : exploration interactive de grandes masses de données en appui à la fouille de données et à l'extraction de connaissances
992,22.98772,-10.806409,pdf_992.txt,2007,fr,"Thanh-Nghi Do, Nguyen-Khang Pham, François Poulet",Visualisation exploratoire des résultats d'algorithmes d'arbre de décision
993,-14.58014,-9.833087,pdf_993.txt,2007,fr,"Mouhamadou Thiam, Nacéra Bennacer, Nathalie Pernelle",WebDocEnrich : enrichissement sémantique flexible de documents semi-structurés
994,-6.0455914,3.021305,pdf_994.txt,2006,fr,"Benoît Favre, Jean-François Bonastre, Patrice Bellot, François Capman",Accès aux connaissances orales par le résumé automatique
995,-18.398603,16.852797,pdf_995.txt,2006,fr,"Edwin Diday, Chérif Mballo",Affectation pondérée sur des données de type intervalle
996,-10.070861,13.508721,pdf_996.txt,2006,fr,Bernard Huet,Aide en gestion hospitalière par visualisation des composantes de non-pertinence
997,4.966387,-20.511547,pdf_997.txt,2006,fr,"Lydia Boudjeloud, François Poulet",Algorithme semi-interactif pour la sélection de dimensions
998,-24.176697,-17.836239,pdf_998.txt,2006,fr,"Jérôme David, Fabrice Guillet, Régis Gras, Henri Briand",Alignement extensionnel et asymétrique de hiérarchies conceptuelles par découverte d'implications entre concepts
999,37.70154,4.4564686,pdf_999.txt,2006,fr,"Hunor Albert-Lorincz, Jean-François Boulicaut",Amélioration des indicateurs techniques pour l'analyse du marché financier
1000,9.126523,-0.6357955,pdf_1000.txt,2006,fr,Sylvain Mongy,Analyse du Comportement des utilisateurs exploitant une base de données vidéo
1001,-21.530054,-15.78514,pdf_1001.txt,2006,fr,"Sylvain Tenier, Amedeo Napoli, Xavier Polanco, Yannick Toussaint",Annotation sémantique de pages web
1002,24.031076,-18.339155,pdf_1002.txt,2006,fr,"Alexandre Aussem, Zahra Kebaili, Marilys Corbex, Fabien De Marchi",Apprentissage de la structure des réseaux bayésiens à partir des motifs fréquents corrélés : application à l'identification des facteurs environnementaux du cancer du Nasopharynx
1003,37.41245,-6.060709,pdf_1003.txt,2006,fr,"Nabil Benayadi, Marc Le Goc, Philippe Bouché",Approche entropique pour l'analyse de modèle de chroniques
1004,-15.764237,12.331562,pdf_1004.txt,2006,fr,"Noura Bouzrara, Nacéra Madani Aissaoui, Najoua Essoukri Ben Amara",ARABASE : Base de données Web pour l'exploitation en reconnaissance optique de l'écriture Arabe
1005,-17.450779,17.683117,pdf_1005.txt,2006,fr,"Frank Meyer, Fabrice Clérot",Arbres de décision multi modes et multi cibles.
